{
  "$schema": "https://json-schema.org/draft/2020-12/schema",
  "$id": "security-report.schema.json",
  "title": "Security Review Report",
  "type": "object",
  "required": [
    "schema_version",
    "task_id",
    "reviewer",
    "reviewed_commit",
    "status",
    "summary",
    "findings"
  ],
  "properties": {
    "schema_version": {
      "type": "string",
      "const": "1.0"
    },
    "task_id": {
      "type": "string"
    },
    "reviewer": {
      "type": "string"
    },
    "reviewed_commit": {
      "type": "string"
    },
    "status": {
      "type": "string",
      "enum": [
        "APPROVED",
        "CHANGES_REQUIRED",
        "BLOCKED"
      ]
    },
    "summary": {
      "type": "string"
    },
    "findings": {
      "type": "array",
      "items": {
        "type": "object",
        "required": [
          "severity",
          "category",
          "description",
          "impact",
          "remediation",
          "blocking"
        ],
        "properties": {
          "severity": {
            "type": "string",
            "enum": [
              "info",
              "low",
              "medium",
              "high",
              "critical"
            ]
          },
          "category": {
            "type": "string"
          },
          "file": {
            "type": "string"
          },
          "description": {
            "type": "string"
          },
          "impact": {
            "type": "string"
          },
          "remediation": {
            "type": "string"
          },
          "blocking": {
            "type": "boolean"
          }
        },
        "additionalProperties": false
      }
    }
  },
  "additionalProperties": false,
  "allOf": [
    {
      "if": {
        "properties": {
          "status": {
            "const": "APPROVED"
          }
        },
        "required": [
          "status"
        ]
      },
      "then": {
        "properties": {
          "findings": {
            "not": {
              "contains": {
                "type": "object",
                "properties": {
                  "blocking": {
                    "const": true
                  }
                },
                "required": [
                  "blocking"
                ]
              }
            }
          }
        }
      }
    }
  ]
}
